{
  "schema_version": "synthea-hospital-feed-profile-v1",
  "hospital_id": "demo-atlanta",
  "feed_id": "demo-atlanta-fhir-r4",
  "location": {
    "state": "Georgia",
    "city": "Atlanta"
  },
  "generation_defaults": {
    "population": 5,
    "seed": 12345,
    "reference_date": "20261024"
  },
  "delivery": {
    "source_format": "FHIR_R4",
    "target_format": "FHIR_R4",
    "transformer": "DIRECT"
  }
}
